{
  "id": "network/download-starts-then-cuts-off-symptom-router",
  "title": "다운로드는 시작됐는데 중간에 끊김 원인 라우터",
  "category": "network",
  "level": "beginner",
  "summary": "다운로드가 이미 시작됐다면 질문은 \"응답이 왜 안 나갔지?\"보다 \"어느 지점까지 나갔고 누가 중간 종료를 먼저 관찰했지?\"로 바뀐다.",
  "body_markdown": "# 다운로드는 시작됐는데 중간에 끊김 원인 라우터\n\n## 한 줄 요약\n\n> 다운로드가 이미 시작됐다면 질문은 \"응답이 왜 안 나갔지?\"보다 \"어느 지점까지 나갔고 누가 중간 종료를 먼저 관찰했지?\"로 바뀐다.\n\n## 관찰에서 첫 분기\n\n- 관찰: DevTools에서 status는 `200` 또는 `206`인데 `Content Download` 중간에 `(failed)`로 끝나고 파일 크기가 기대보다 짧다. 첫 분기: controller 진입 실패보다 partial delivery와 body 단계 중단으로 본다. 다음 확인: edge/origin의 `bytes_sent`, `Content-Length` 또는 range, 실제 파일 checksum을 같은 request id로 맞춘다.\n- 관찰: edge에는 `499`나 client reset이 있고 origin access log는 `200`으로 남는다. 첫 분기: app 성공/실패 이분법보다 클라이언트 또는 앞단이 먼저 끊은 후 origin이 늦게 알게 된 장면으로 본다. 다음 확인: edge 종료 시각, origin 마지막 write 시각, `broken pipe` 발생 시각, 사용자 탭 이동/취소 이벤트를 비교한다.\n- 관찰: 큰 파일이나 느린 네트워크에서만 중간 종료가 반복된다. 첫 분기: 비즈니스 로직 회귀보다 proxy idle timeout, buffering, TLS/transport truncation 후보를 먼저 둔다. 다음 확인: hop별 idle timeout, chunk 간격, proxy response buffering 여부, FIN/RST 또는 `close_notify` 흔적을 확인한다.\n\n## 가능한 원인\n\n1. 사용자가 페이지를 떠나거나 브라우저, 프록시, 모바일 네트워크가 먼저 연결을 닫은 경우다. edge에는 `499`, origin에는 `200`이나 일부 bytes sent만 남을 수 있어 \"서버는 성공인데 사용자는 실패\"처럼 보인다. 다음 문서: [Client Disconnect, 499, Broken Pipe, Cancellation in Proxy Chains](./client-disconnect-499-broken-pipe-cancellation-proxy-chain.md), [Access Log Correlation Recipes: Tomcat, Jetty, Undertow](./access-log-correlation-recipes-tomcat-jetty-undertow.md)\n2. 응답은 커밋됐지만 그 뒤 write나 flush에서 늦게 실패한 경우다. `broken pipe`, `ClientAbortException`, `AsyncRequestNotUsableException`은 종종 \"첫 실패 원인\"이 아니라 이미 끊긴 연결에 대한 후속 표면이다. 다음 문서: [Spring `DisconnectedClientHelper` Breadcrumb Wiring: MVC Download, SSE, Async Late Write](./spring-disconnectedclienthelper-breadcrumb-wiring-mvc-download-sse-async-late-write.md), [Spring MVC Async `onError` -> `AsyncRequestNotUsableException` Crosswalk](./spring-mvc-async-onerror-asyncrequestnotusableexception-crosswalk.md)\n3. proxy, CDN, LB의 idle timeout이나 buffering 정책이 body 전송 중간에 먼저 끝난 경우다. app은 계속 쓰고 있다고 생각하지만 앞단이 먼저 닫아 사용자는 다운로드 중단으로 본다. 다음 문서: [HTTP Response Compression, Buffering, Streaming Trade-offs](./http-response-compression-buffering-streaming-tradeoffs.md), [Client Disconnect, 499, Broken Pipe, Cancellation in Proxy Chains](./client-disconnect-499-broken-pipe-cancellation-proxy-chain.md)\n4. TLS close 방식이나 transport 종료가 어긋나 truncation처럼 보이는 경우다. `close_notify` 없이 FIN/RST가 먼저 오면 파일이 일부만 온 장면과 인증서/암호화 문제를 섞어 읽기 쉽다. 다음 문서: [TLS `close_notify`, FIN/RST, Truncation](./tls-close-notify-fin-rst-truncation.md), [FIN, RST, Half-Close, EOF](./fin-rst-half-close-eof-semantics.md)\n\n## 빠른 자기 진단\n\n1. DevTools waterfall에서 `Waiting`이 길었는지, `Content Download`가 길다가 끊겼는지 먼저 나눈다. 다운로드 중단이면 대개 `body` 단계 해석이 먼저다.\n2. edge와 origin에서 같은 요청의 `status`, `bytes_sent`, `duration`, disconnect 표면을 같이 본다. edge `499` + origin `200`은 partial delivery 후보고, 둘 다 짧게 끝나면 pre-commit 실패 후보가 더 크다.\n3. app 로그의 예외 시각이 첫 write 직전인지, 이미 일부 바이트를 보낸 뒤인지 확인한다. late write면 business 예외보다 cleanup/중단 전파 해석이 더 맞다.\n4. 문제 구간이 큰 파일, 느린 모바일 네트워크, 배포 직후, 특정 proxy hop에서만 반복되는지 적는다. 재현 조건이 좁혀지면 timeout, buffering, transport 종료 갈래가 빨리 갈린다.\n5. 파일 크기나 checksum이 기대보다 짧다면 \"응답을 누가 만들었나\"보다 \"마지막 정상 바이트가 어디까지 갔나\"를 먼저 추적한다.\n\n## 다음 학습\n\n- `499`, cancel 전파, proxy chain 관점을 먼저 잡으려면 [Client Disconnect, 499, Broken Pipe, Cancellation in Proxy Chains](./client-disconnect-499-broken-pipe-cancellation-proxy-chain.md)\n- container access log의 `bytes_sent`와 duration을 함께 읽으려면 [Access Log Correlation Recipes: Tomcat, Jetty, Undertow](./access-log-correlation-recipes-tomcat-jetty-undertow.md)\n- TLS truncation과 FIN/RST 종료 감각이 약하면 [TLS `close_notify`, FIN/RST, Truncation](./tls-close-notify-fin-rst-truncation.md)\n- 브라우저에서 숫자 상태보다 `(failed)`가 먼저 보였다면 [Browser DevTools `(blocked)` / `canceled` / `(failed)` 원인 라우터](./browser-devtools-blocked-canceled-failed-symptom-router.md)\n",
  "aliases": [
    "다운로드가 시작되다가 중간에 끊겨요",
    "파일 받다가 갑자기 멈춰요",
    "200으로 내려오는데 파일이 끝까지 안 와요",
    "응답은 시작됐는데 body가 중간에서 잘려요",
    "다운로드 도중 네트워크 오류가 떠요",
    "파일 전송이 끝나기 전에 브라우저가 끊어진 것 같아요"
  ],
  "expected_queries": [
    "다운로드가 중간에 끊기는데 서버가 실패한 건지 사용자가 먼저 나간 건지 어떻게 구분해?",
    "상태는 200인데 파일이 끝까지 안 오면 어느 로그를 먼저 봐야 해?",
    "edge에는 499가 찍히고 origin은 200이면 partial delivery로 봐야 해?",
    "broken pipe나 ClientAbortException이 보일 때 서버 버그와 응답 중간 종료를 어떻게 나눠 읽어?",
    "큰 응답 body가 시작된 뒤 멈출 때 timeout, truncation, client disconnect 중 무엇부터 확인해야 해?"
  ],
  "symptoms": [
    "브라우저에서 파일 다운로드나 큰 응답 body가 시작되긴 했는데 중간에 멈추거나 네트워크 오류로 끝나서 서버가 실패한 건지 사용자가 먼저 떠난 건지 모르겠다",
    "상태 코드는 `200`이나 `206`으로 보이는데 받은 파일이 일부만 오거나 깨져 있어서 app 버그, proxy timeout, client disconnect 중 어디부터 봐야 할지 헷갈린다",
    "edge에서는 `499`나 reset 흔적이 보이는데 origin access log는 `200`으로 남아 partial delivery인지 late write인지 해석이 갈린다",
    "download API에서 `broken pipe`, `ClientAbortException`, `AsyncRequestNotUsableException`이 보이는데 이게 실제 서버 회귀인지 응답 커밋 뒤 종료인지 바로 설명하기 어렵다"
  ],
  "relations": {
    "prerequisites": [
      "network/devtools-waterfall-primer",
      "network/request-timing-decomposition"
    ],
    "next_docs": [
      "network/browser-devtools-blocked-canceled-failed-symptom-router",
      "network/request-pending-forever-symptom-router",
      "network/request-timing-decomposition",
      "network/browser-502-no-app-log-symptom-router"
    ],
    "confusable_with": [
      "network/request-pending-forever-symptom-router",
      "network/browser-devtools-blocked-canceled-failed-symptom-router",
      "network/upload-finishes-then-rejected-symptom-router"
    ],
    "forbidden_for_queries": []
  },
  "learner_query_patterns": [],
  "metadata": {
    "schema_version": "v2",
    "created_at": "2026-05-24",
    "last_modified": "2026-05-24",
    "legacy_path": "knowledge/cs/contents/network/다운로드는-시작됐는데-중간에-끊김-원인-라우터.md",
    "revision_history": []
  }
}