{
  "id": "data-structure/ring-buffer-vs-queue-interview-drill",
  "title": "Ring Buffer vs Queue Interview Drill",
  "category": "data-structure",
  "level": "intermediate",
  "summary": "이 drill은 ring buffer, circular queue, bounded queue overflow policy를 면접 답변으로 설명한다.",
  "body_markdown": "# Ring Buffer vs Queue Interview Drill\n\n## 질문\n\n\"Ring Buffer는 일반 Queue와 무엇이 다르고, overflow 정책은 어떻게 정하나요?\"\n\n## 기대 답변 축\n\n- Ring buffer는 고정 크기 배열을 원형으로 사용해 head/tail index를 순환시킨다.\n- modulo 또는 power-of-two mask로 index를 감싼다.\n- full/empty 구분을 위해 size를 따로 두거나 한 칸을 비우거나 sequence를 사용한다.\n- overflow 때 block, drop newest, drop oldest, fail-fast 중 요구에 맞는 정책을 정한다.\n\n## 30초 비교 답변\n\n| 구분 | Queue | Ring buffer |\n|---|---|---|\n| 층위 | FIFO ADT | queue를 구현할 수 있는 bounded circular array |\n| 용량 | unbounded일 수도 bounded일 수도 있음 | 보통 fixed capacity |\n| 핵심 상태 | head/front와 tail/rear | head/tail index, size 또는 sequence |\n| 초과 입력 | 구현/정책에 따라 다름 | full 상태 정책을 반드시 정해야 함 |\n| 강점 | 의미가 단순하고 API가 익숙함 | allocation이 적고 메모리 상한이 명확함 |\n\n면접에서는 \"Queue는 먼저 들어온 것을 먼저 처리한다는 추상 규칙이고, ring buffer는 그 규칙을 고정 배열 위에서 구현하는 한 방식\"이라고 분리해서 시작하면 안전하다.\n\n## 선택 기준\n\n- Queue는 FIFO ADT이고, ring buffer는 bounded circular array 구현이라는 층위를 먼저 구분한다.\n- 입력 속도가 출력 속도보다 빠를 수 있는지, 그때 메모리를 고정해야 하는지 확인한다.\n- command/event처럼 손실이 치명적이면 reject나 block이 자연스럽고, metrics sample처럼 최신 값만 중요하면 drop-old가 가능하다.\n- full/empty 구분과 overflow 정책을 단순히 구현 세부가 아니라 API contract로 문서화한다.\n- concurrent queue가 필요하면 직접 구현보다 검증된 bounded queue나 Disruptor류를 검토한다.\n\n## 핵심 invariant\n\n- empty와 full이 같은 `head == tail` 표현을 공유하면 추가 상태 없이 구분할 수 없다.\n- `size`, `one-empty-slot`, `sequence number` 중 하나로 slot 상태를 명확히 해야 한다.\n- FIFO queue로 쓰는 동안에는 아직 읽지 않은 slot을 overwrite하면 안 된다.\n- drop-old 정책을 선택했다면 overwrite는 허용되지만, 그 순간 잃은 원소 수와 순서 의미를 명시해야 한다.\n- producer/consumer가 여러 개면 head/tail 갱신이 atomic하고 memory visibility가 보장되어야 한다.\n- enqueue 성공 후에는 해당 원소가 정확히 한 번 dequeue되거나, 명시된 overflow/drop 정책으로만 사라져야 한다.\n- dequeue는 empty 상태에서 값을 만들어내면 안 된다. empty 반환, exception, blocking 중 API contract가 필요하다.\n- full 상태의 `offer`가 false를 반환하는지, `put`이 block하는지, `add`가 exception을 던지는지 메서드 의미를 구분해야 한다.\n- sequence number를 쓰면 index가 같은 slot으로 돌아와도 이전 세대 데이터와 현재 세대 데이터를 구분해야 한다.\n\n## Complexity/운영 비용\n\n- ring buffer enqueue/dequeue는 보통 `O(1)`이고 allocation이 적다.\n- linked queue는 capacity 제한이 없으면 burst를 메모리로 흡수하지만 GC와 tail latency 비용이 커질 수 있다.\n- bounded blocking queue는 `put/take`가 backpressure를 제공하지만 thread blocking 비용을 만든다.\n- modulo, lock, CAS, false sharing 같은 hot path 비용은 throughput이 높은 시스템에서만 주요 병목이 된다.\n- 운영에서는 capacity sizing, overflow count, consumer lag, retry 정책을 함께 관리한다.\n\n## 실패 반례\n\n- `head == tail`을 empty로만 해석하면 full 상태에서 데이터를 덮어쓰거나 더 이상 삽입하지 못하는 버그가 생긴다.\n- 주문 처리 command queue에 drop-old를 적용하면 오래된 주문이 조용히 사라진다.\n- request thread가 bounded queue에 무기한 block되면 부하 상황에서 전체 API worker가 묶인다.\n- `ArrayDeque` 같은 일반 collection을 여러 스레드에서 lock 없이 공유하면 구조가 깨질 수 있다.\n- capacity 1에서 one-empty-slot 방식을 쓰면 실제로 저장 가능한 칸이 없어질 수 있다.\n- modulo를 빼먹고 index만 증가시키면 배열 범위를 벗어나고, overflow된 정수로 음수 index가 될 수도 있다.\n- drop-new 정책을 쓰면서 enqueue 성공처럼 반환하면 caller는 처리됐다고 믿고 재시도 기회를 잃는다.\n\n## 흔한 오해\n\n- Ring buffer는 queue와 완전히 다른 ADT가 아니라 queue를 구현할 수 있는 bounded 구조다.\n- circular index만 있으면 ring buffer가 완성되는 것이 아니다. full/empty와 overflow contract가 핵심이다.\n- capacity를 크게 잡는 것은 backpressure 설계가 아니다. 지연과 메모리 사용을 뒤로 미룰 뿐이다.\n- lock-free 구현이 항상 빠른 것은 아니다. contention, cache line, 배치 처리에 따라 결과가 달라진다.\n\n## 약점 태그\n\n- `full-empty`: full과 empty 상태 구분을 설명하지 못함\n- `overflow-policy`: 초과 입력 정책이 없음\n- `backpressure`: producer 속도 제어와 연결하지 못함\n\n## 미니 edge-case drill\n\n용량 3에서 `enqueue A, B, C` 후 full을 어떻게 표현하는지 설명한다. 그다음 `enqueue D`를 block, reject, drop-new, drop-old로 각각 처리하면 queue 내용과 반환값이 어떻게 달라지는지 말해 본다.\n\n## 복습 연결\n\noverflow 선택은 `bounded-queue-overflow-policy-chooser`로 이어진다.\n",
  "aliases": [
    "ring buffer queue drill",
    "링버퍼 큐 차이",
    "원형 버퍼 overflow 정책",
    "bounded queue backpressure",
    "full empty 상태 구분",
    "circular buffer 면접 답변",
    "drop oldest reject block",
    "고정 배열 큐 구현"
  ],
  "expected_queries": [
    "Ring Buffer와 일반 Queue 차이를 면접에서 어떻게 설명해?",
    "원형 버퍼에서 full과 empty는 어떻게 구분해야 해?",
    "bounded queue가 꽉 찼을 때 drop과 block 중 무엇을 골라야 해?",
    "metrics 버퍼와 주문 큐는 overflow 정책이 왜 달라야 해?",
    "head tail index를 modulo로 감싸는 이유가 뭐야?"
  ],
  "symptoms": [
    "ring buffer를 그냥 배열 queue로만 설명해요",
    "full/empty 상태 구분을 놓쳐요",
    "overflow 때 drop/block/fail 정책을 정하지 않아요"
  ],
  "relations": {
    "prerequisites": [
      "data-structure/ring-buffer"
    ],
    "next_docs": [
      "data-structure/bounded-queue-overflow-policy-chooser"
    ],
    "confusable_with": [
      "data-structure/circular-queue-vs-ring-buffer",
      "data-structure/bounded-queue-overflow-policy-chooser"
    ],
    "forbidden_for_queries": []
  },
  "learner_query_patterns": [],
  "metadata": {
    "schema_version": "v2",
    "created_at": "2026-05-24",
    "last_modified": "2026-06-18",
    "legacy_path": "knowledge/cs/contents/data-structure/ring-buffer-vs-queue-interview-drill.md",
    "revision_history": [
      {
        "date": "2026-06-18",
        "source": "y14-expansion-batch146"
      }
    ]
  }
}
