{
  "id": "database/roomescape-admin-pagination-n-plus-one-triage-bridge",
  "title": "Roomescape Admin Pagination N Plus One Triage Bridge",
  "category": "database",
  "level": "intermediate",
  "summary": "이 mission_bridge는 roomescape-admin 목록 API의 N+1, pagination, fetch plan 문제를 SQL 로그 기반으로 연결한다.",
  "body_markdown": "# Roomescape Admin Pagination N Plus One Triage Bridge\n\n## 미션 장면\n\n룸이스케이프 관리자 목록은 예약(reservation) 한 줄에 회원(member), 테마(theme), 시간(time)을 같이 보여준다. 학습자가 \"페이지네이션(pagination)만 넣었는데 왜 SQL이 많아졌지?\"라고 느끼면 먼저 화면 요구와 저장 모델을 분리해서 본다. 목록 20건을 가져오는데 예약 조회 1번 뒤에 회원, 테마, 시간 조회가 행 수만큼 반복되면 N+1(N plus one) 후보가 맞다. 다만 \"SQL이 많다\"만으로 바로 fetch join이 정답이라고 말하면 위험하다. 어떤 연관이 반복되는지, 반복 조회가 to-one인지 collection인지, count query가 어떻게 만들어지는지까지 봐야 한다.\n\n## 리뷰에서 보이는 냄새\n\n- Hibernate SQL 로그에서 같은 `select ... where id = ?`가 여러 번 반복된다.\n- 요청 한 번의 query count가 page size에 비례해서 증가한다.\n- `Page<Reservation>`에 collection fetch join을 붙인 뒤 row 중복, count 오류, in-memory pagination 경고가 보인다.\n- DTO에 필요한 값은 네 개뿐인데 entity 전체와 지연 로딩(lazy loading)을 그대로 노출한다.\n- page size를 10에서 50으로 바꿨을 때 SQL 수가 같이 늘어나면 fetch plan 문제일 가능성이 커진다.\n- count query와 content query가 서로 다른 join/filter를 타서 \"총 개수는 맞는데 현재 페이지 row가 비거나 중복되는\" 증상이 보인다.\n\n불변식(invariant)은 \"페이지의 기준 row는 reservation이어야 한다\"는 점이다. 조인 후 reservation이 child row 수만큼 늘어나면 목록 총 개수, offset, limit이 흔들릴 수 있다.\n\n## N+1 증거 수집\n\n리뷰에서 가장 먼저 해야 할 일은 \"느낌상 많다\"가 아니라 한 요청의 query shape를 증거로 남기는 것이다. 다음 세 가지를 같이 보면 원인이 빨리 좁혀진다.\n\n- 요청 식별자별 SQL 로그: reservation page query 1번 뒤에 `member_id = ?`, `theme_id = ?`, `time_id = ?` 같은 FK lookup이 반복되는지 본다.\n- query count와 page size 상관: page size N에서 `1 + N`, `1 + 2N`, `1 + 3N` 패턴이면 lazy to-one 반복 조회를 의심한다.\n- 실행 계획과 row 수: join 후 row가 reservation 기준으로 유지되는지, collection join으로 reservation row가 증폭되는지 확인한다.\n\n예를 들어 관리자 예약 목록 20건에서 content query 1번, member 조회 20번, theme 조회 20번, time 조회 20번이면 \"N+1이 있다\"는 근거가 된다. 반대로 SQL 2번이어도 count query가 full scan이면 문제의 성격은 N+1이 아니라 pagination/count 최적화다.\n\n## 개념 문서 handoff\n\n첫 단계는 관찰 증거(observable evidence)다. SQL log, Hibernate statistics, `p6spy` 같은 도구로 query count와 반복되는 FK를 확인한다. 화면이 읽기 전용 목록이면 DTO projection이 가장 단순할 수 있다. `reservation.id`, `member.name`, `theme.name`, `time.start_at`처럼 필요한 column만 join해서 가져오면 lazy loading을 건드리지 않는다. 도메인 로직에서 entity graph가 필요하면 to-one fetch join이나 entity graph를 검토할 수 있지만, collection fetch join과 pagination 조합은 특히 조심한다. fetch join은 \"N+1 위험을 줄이는 도구\"이지 \"페이지 결과의 정확성을 자동 보장하는 장치\"가 아니다.\n\nTradeoff도 남는다. DTO projection은 조회 모델이 늘어나는 대신 목록 성능과 row shape가 명확하다. Entity graph는 도메인 객체를 유지하기 쉽지만 query shape가 숨겨질 수 있다. Batch size는 query 수를 줄일 수 있으나 여전히 화면에 불필요한 객체를 읽을 수 있다.\n\nPagination과 fetch plan은 다음 순서로 고른다.\n\n1. 목록 화면 필드가 고정되어 있고 수정 로직이 없으면 DTO projection으로 page 기준 row를 reservation에 고정한다.\n2. to-one 연관만 필요하면 fetch join/entity graph가 비교적 안전하지만 count query가 분리되어 생성되는지 확인한다.\n3. to-many collection이 필요하면 page id를 먼저 구한 뒤 두 번째 query로 collection을 읽거나, 별도 summary/read model을 둔다.\n4. offset이 깊어져 느리면 N+1 해결과 별개로 seek pagination 또는 검색 조건 index를 검토한다.\n\n## Drill 후보\n\n\"Pagination API에서 fetch join이 항상 정답인가?\"로 복습한다. 좋은 답은 \"아니다. SQL 로그로 반복 연관을 확인하고, page 기준 row와 count query를 보존해야 한다. 목록 필드가 고정이면 DTO projection을 먼저 고려하고, fetch join은 to-one인지 collection인지에 따라 위험이 다르다\"까지 말한다. 더 이어 볼 문서는 `spring/roomescape-admin-search-pagination-query-model-bridge`, 기본 원리는 `database/join-n-plus-one-interview-router`다.\n",
  "aliases": [
    "roomescape admin pagination n plus one triage",
    "룸이스케이프 관리자 목록 N+1 페이지네이션",
    "reservation list SQL 21 times bridge",
    "admin list fetch plan database bridge"
  ],
  "expected_queries": [
    "roomescape 관리자 목록에서 SQL이 너무 많이 나가면 뭘 봐?",
    "pagination이 있는데 fetch join을 그냥 써도 돼?",
    "예약 목록 N+1을 SQL 로그로 어떻게 확인해?"
  ],
  "symptoms": [
    "예약 목록 20개 조회에 SQL이 21번 나갑니다",
    "page query에 fetch join을 붙였더니 중복 row나 count가 이상합니다",
    "DTO projection과 entity graph 중 무엇을 고를지 모르겠습니다"
  ],
  "relations": {
    "prerequisites": [
      "database/join-n-plus-one-interview-router"
    ],
    "next_docs": [
      "spring/roomescape-admin-search-pagination-query-model-bridge",
      "database/pagination-offset-vs-seek"
    ],
    "confusable_with": [
      "database/join-n-plus-one-interview-router",
      "spring/roomescape-admin-reservation-list-fetch-plan-bridge"
    ],
    "forbidden_for_queries": []
  },
  "learner_query_patterns": [],
  "metadata": {
    "schema_version": "v2",
    "created_at": "2026-05-24",
    "last_modified": "2026-05-24",
    "legacy_path": "knowledge/cs/contents/database/roomescape-admin-pagination-n-plus-one-triage-bridge.md",
    "revision_history": []
  }
}