{
  "id": "security/password-hashing-bcrypt-argon2-parameter-chooser",
  "title": "Password Hashing BCrypt / Argon2 Parameter Chooser",
  "category": "security",
  "level": "intermediate",
  "summary": "|",
  "body_markdown": "# Password Hashing BCrypt / Argon2 Parameter Chooser\n\n> 한 줄 요약: 새 시스템은 Argon2id를 우선 검토하고, 운영/프레임워크 호환성이 중요하면 bcrypt도 안전한 선택이다. PBKDF2는 주로 FIPS 같은 규제 호환성 때문에 선택한다. 무엇을 고르든 unique salt, 충분한 cost, metadata 저장, 점진 migration이 핵심이다.\n\n**난이도: 🟡 Intermediate**\n\n> 관련 문서:\n> - [Password Hashing Basics](./password-hashing-basics.md)\n> - [비밀번호 해싱 — BCrypt vs Argon2 vs PBKDF2 어떻게 고를까](./password-hashing-bcrypt-vs-argon2-vs-pbkdf2-intermediate-bridge.md)\n> - [비밀번호 저장: bcrypt / scrypt / argon2](./password-storage-bcrypt-scrypt-argon2.md)\n> - [Password Hashing Salt Pepper Interview Drill](./password-hashing-salt-pepper-interview-drill.md)\n> - [Hashing vs Encryption vs Encoding Primer](./hashing-vs-encryption-vs-encoding-primer.md)\n> - [Brute Force Protection Basics](./brute-force-protection-basics.md)\n\nretrieval-anchor-keywords: password hashing parameter chooser, bcrypt cost factor, argon2id memory cost, argon2id m t p, PBKDF2 HMAC SHA-256 iteration, password hash migration, salt pepper work factor, 비밀번호 해싱 파라미터, bcrypt argon2id pbkdf2 비교, SHA-256 password migration\n\n## 먼저 고르는 10초 표\n\n| 상황 | 1차 선택 | 왜 |\n|---|---|---|\n| 새 시스템이고 라이브러리/운영 메모리 예산이 충분하다 | `Argon2id` | memory-hard라 GPU/ASIC 대량 추측 비용을 키우기 좋다 |\n| Spring 등 프레임워크 default, 운영 호환성, 오래 검증된 구현이 중요하다 | `bcrypt` | 구현과 운영 경험이 넓고 cost 조정이 단순하다 |\n| FIPS-140 같은 규제 요구가 강하다 | `PBKDF2-HMAC-SHA-256` | memory-hard는 아니지만 표준/인증 환경에서 채택하기 쉽다 |\n| 레거시가 MD5/SHA-1/SHA-256 단일 호출이다 | 새 algorithm으로 login-time rehash | 원문 비밀번호 없이 안전하게 일괄 변환할 수 없다 |\n\n짧은 규칙:\n\n- Argon2id는 memory budget까지 운영 설계해야 한다.\n- bcrypt는 72-byte 입력 제한과 cost calibration을 알아야 한다.\n- PBKDF2는 FIPS compatibility 선택지이지 GPU 방어력 최강 선택지는 아니다.\n\n## OWASP 기준 baseline\n\nOWASP Password Storage Cheat Sheet의 현재 baseline은 아래처럼 읽으면 된다.\n\n| 알고리즘 | OWASP baseline | 실무 해석 |\n|---|---|---|\n| `Argon2id` | memory 19 MiB, iterations 2, parallelism 1 이상 | baseline이다. 서버 여유가 있으면 더 높여도 되지만 login p95와 동시성 예산을 같이 본다 |\n| `bcrypt` | work factor 10 이상, 72-byte password limit 고려 | cost 10은 floor다. 운영 장비에서 100-500ms 안쪽 목표로 재측정한다 |\n| `PBKDF2-HMAC-SHA-256` | 600,000 iterations 이상 | FIPS 필요 시 선택한다. CPU-only라 online DoS와 latency 예산을 같이 본다 |\n\n이 숫자는 \"영원한 정답\"이 아니라 minimum floor다. 배포 장비, login traffic, rate limit, 장애 예산이 바뀌면 다시 측정한다.\n\n## parameter를 정하는 순서\n\n1. 보안 요구를 먼저 고른다: 일반 웹, 고위험 계정, 규제/FIPS, embedded/mobile client 여부.\n2. candidate algorithm을 고른다: Argon2id, bcrypt, PBKDF2 중 하나.\n3. staging 장비에서 hash verify 시간을 측정한다.\n4. peak login 동시성에서 CPU와 memory가 버티는지 본다.\n5. 정상 login p95가 과도하게 느려지지 않는 최대 parameter를 고른다.\n6. rate limit, credential stuffing 탐지, MFA를 같이 둔다.\n\npassword hashing은 DB 유출 뒤 offline cracking 비용을 올린다. 로그인 endpoint를 직접 때리는 online brute force는 hashing만으로 막지 못하므로 [Brute Force Protection Basics](./brute-force-protection-basics.md)를 같이 봐야 한다.\n\n## bcrypt parameter\n\nbcrypt의 핵심 parameter는 cost다. cost가 1 올라가면 대체로 계산량이 두 배로 늘어난다.\n\n| 볼 것 | 기준 |\n|---|---|\n| cost | 최소 10 이상, 운영 장비에서 login p95 기준으로 상향 |\n| input limit | bcrypt는 보통 72 bytes 이후 입력을 잘라내는 구현 제한을 가진다 |\n| metadata | `$2b$12$...`처럼 version, cost, salt, hash가 verifier 문자열에 들어간다 |\n| migration | `matches()` 성공 뒤 `upgradeEncoding()` 같은 경로로 재hash |\n\n주의:\n\n- 긴 passphrase를 받을 수 있다면 bcrypt truncation 정책을 라이브러리 문서로 확인한다.\n- pre-hash를 넣을 때는 임의 SHA-256 한 번이 아니라 안전한 encoding/HMAC 전략과 라이브러리 호환성을 검토한다.\n- test가 느리다고 production cost를 낮추지 말고 test fixture를 분리한다.\n\n## Argon2id parameter\n\nArgon2id는 단순 work factor 하나가 아니라 memory, iteration, parallelism을 같이 본다.\n\n| parameter | 의미 | 운영 질문 |\n|---|---|---|\n| `m` memory | hash 하나가 요구하는 memory | peak login 동시성에서 총 memory가 버티나 |\n| `t` iterations/passes | memory를 몇 번 통과할지 | latency가 허용 범위 안인가 |\n| `p` parallelism | lane 수 | 서버 CPU core와 라이브러리 구현에 맞나 |\n\n예시:\n\n```text\n$argon2id$v=19$m=65536,t=3,p=1$<salt>$<hash>\n```\n\n이 문자열처럼 algorithm과 parameter가 저장되어야 다음 migration 판단이 가능하다.\n\nArgon2id는 \"높을수록 무조건 좋다\"가 아니다. memory를 너무 높이면 login burst가 곧 memory pressure나 OOM이 되고, 공격자가 login endpoint를 이용한 DoS를 만들 수 있다.\n\n## PBKDF2 parameter\n\nPBKDF2는 `HMAC-SHA-256` 같은 PRF와 iteration count를 정한다.\n\n| 장점 | 한계 |\n|---|---|\n| 표준성, FIPS 호환, 구현 가용성이 좋다 | memory-hard가 아니라 GPU/ASIC 방어 관점에서는 Argon2id/scrypt보다 불리하다 |\n| verifier format과 iteration migration이 단순하다 | 높은 iteration은 login CPU 비용과 DoS 표면을 키운다 |\n\nPBKDF2를 고르는 이유가 \"가장 강해서\"라면 다시 검토한다. 이유가 \"규제 환경에서 검증된 KDF가 필요해서\"라면 타당한 선택일 수 있다.\n\n## salt와 pepper\n\n| 항목 | 저장 위치 | 비밀인가 | 목적 |\n|---|---|---|---|\n| salt | hash/verifier와 함께 저장 | 아니다 | 같은 password도 사용자마다 다른 hash가 되게 하고 precomputed table 재사용을 막는다 |\n| pepper | KMS, secret manager, HSM, 별도 env 등 DB 밖 | 맞다 | DB dump만 유출됐을 때 offline cracking 비용을 더 올린다 |\n| work factor | hash metadata | 아니다 | 시간이 지나도 parameter upgrade 판단이 가능하게 한다 |\n\nsalt는 숨기는 값이 아니다. 사용자별 unique random이면 되고, 검증된 password hashing library가 자동으로 생성/저장하는 방식을 쓰는 편이 안전하다.\n\npepper는 optional defense-in-depth다. 쓰려면 아래 조건을 만족해야 한다.\n\n- DB dump와 함께 유출되지 않는 저장소에 둔다.\n- rotation 절차를 문서화한다.\n- pepper를 잃으면 password verification이 실패한다는 운영 영향을 받아들인다.\n- 단순 문자열 덧붙이기보다 HMAC pepper나 라이브러리 지원 secret parameter를 검토한다.\n\n## migration playbook\n\n레거시 hash를 안전하게 옮기는 기본은 \"성공 login 때 재hash\"다.\n\n1. 저장된 verifier에 `{algorithm, parameter}` metadata를 남긴다.\n2. login 시 old verifier로 먼저 검증한다.\n3. 검증 성공 후 현재 정책의 Argon2id/bcrypt/PBKDF2로 새 verifier를 만든다.\n4. 새 verifier로 교체하고 audit log에는 원문 password를 절대 남기지 않는다.\n5. 장기간 login하지 않는 계정은 reset flow로 유도한다.\n\n절대 하지 말 것:\n\n- raw password 없이 old SHA-256 hash를 bcrypt로 다시 감싸고 \"마이그레이션 완료\"라고 부르기\n- 모든 사용자에게 동일 salt를 쓰기\n- algorithm/cost를 숨기면 안전해진다고 믿기\n- verifier를 `==`로 비교하고 timing side channel을 방치하기\n- password reset token이나 임시 password를 password hash와 같은 방식으로 장기 저장하기\n\n## 검증 checklist\n\n| 체크 | 통과 기준 |\n|---|---|\n| algorithm | Argon2id, bcrypt, PBKDF2 중 정책으로 명시되어 있다 |\n| salt | 사용자별 unique salt가 verifier에 포함되어 있다 |\n| parameter | cost/memory/iteration이 verifier metadata로 남는다 |\n| calibration | production-like 장비에서 login p95와 peak 동시성을 측정했다 |\n| migration | old verifier 성공 시 current policy로 rehash한다 |\n| defense layers | rate limit, credential stuffing 탐지, MFA를 hashing과 별도 축으로 둔다 |\n\n## Primary references\n\n- OWASP Password Storage Cheat Sheet: https://cheatsheetseries.owasp.org/cheatsheets/Password_Storage_Cheat_Sheet.html\n- RFC 9106 Argon2 Memory-Hard Function: https://www.rfc-editor.org/rfc/rfc9106.html\n\n## 한 줄 정리\n\n비밀번호 해싱의 좋은 답은 \"bcrypt를 쓴다\"가 아니라 \"환경에 맞는 algorithm을 고르고, salt/pepper/cost metadata를 분리하고, 장비에서 측정한 parameter를 시간이 지나며 점진 upgrade한다\"다.\n",
  "aliases": [
    "password hashing parameter chooser",
    "bcrypt argon2 parameter chooser",
    "bcrypt cost factor",
    "argon2id memory cost",
    "pbkdf2 iteration count",
    "password hash migration",
    "salt pepper work factor",
    "비밀번호 해싱 파라미터 선택",
    "bcrypt와 argon2id 설정",
    "salt pepper work factor migration"
  ],
  "expected_queries": [
    "bcrypt와 Argon2id 중 무엇을 고르고 cost는 어떻게 정해?",
    "비밀번호 해싱에서 salt pepper work factor를 어떻게 설명해?",
    "PBKDF2는 언제 써야 하고 iteration은 어떻게 정해?",
    "레거시 SHA-256 비밀번호 hash를 bcrypt나 Argon2id로 어떻게 마이그레이션해?",
    "password hashing parameter chooser가 필요한 이유를 알려줘"
  ],
  "symptoms": [
    "bcrypt cost를 얼마로 둬야 할지 모르겠어요",
    "Argon2id memory와 iteration 값을 어떻게 정해야 하는지 헷갈려요",
    "salt와 pepper를 둘 다 써야 하는지 모르겠어요",
    "SHA-256이나 MD5로 저장된 비밀번호를 어떻게 옮길지 막혔어요"
  ],
  "relations": {
    "prerequisites": [
      "security/password-hashing-basics"
    ],
    "next_docs": [
      "security/password-hashing-bcrypt-vs-argon2-vs-pbkdf2-intermediate-bridge",
      "security/brute-force-protection-basics"
    ],
    "confusable_with": [
      "security/password-hashing-basics",
      "security/hashing-vs-encryption-vs-encoding-primer",
      "security/brute-force-protection-basics"
    ],
    "forbidden_for_queries": []
  },
  "learner_query_patterns": [],
  "metadata": {
    "schema_version": "v2",
    "created_at": "2026-05-24",
    "last_modified": "2026-05-24",
    "legacy_path": "knowledge/cs/contents/security/password-hashing-bcrypt-argon2-parameter-chooser.md",
    "revision_history": []
  }
}