{
  "id": "language/priorityblockingqueue-cancellation-stale-entry-mini-bridge",
  "title": "PriorityBlockingQueue Cancellation Stale Entry Mini Bridge",
  "category": "language",
  "level": "beginner",
  "summary": "PriorityBlockingQueue에서 cancel이나 priority update가 들어오면, 초보자 기본값은 queue 안 entry를 직접 고치기보다 새 entry를 넣고 예전 entry는 stale로 버리는 것이다.",
  "body_markdown": "# `PriorityBlockingQueue` Cancellation/Update Mini Bridge\n\n> 한 줄 요약: `PriorityBlockingQueue`에서 cancel이나 priority update가 들어오면, 초보자 기본값은 **queue 안 entry를 직접 고치기보다 새 entry를 넣고 예전 entry는 stale로 버리는 것**이다.\n\n**난이도: 🟢 Beginner**\n\n> 관련 문서:\n> - [Priority Update Patterns](./priority-update-patterns-treeset-treemap-priorityqueue-bridge.md)\n> - [Thread Interruption and Cooperative Cancellation Playbook](./thread-interruption-cooperative-cancellation-playbook.md)\n> - [PriorityBlockingQueue Timer Misuse Primer](../../data-structure/priorityblockingqueue-timer-misuse-primer.md)\n> - [Mutable Priority Stale Ticket Pattern](../../data-structure/mutable-priority-stale-ticket-pattern.md)\n> - [Java PriorityQueue Pitfalls](../../data-structure/java-priorityqueue-pitfalls.md)\n>\n> retrieval-anchor-keywords: language-java-00124, PriorityBlockingQueue cancellation update, priorityblockingqueue duplicate entries, priorityblockingqueue stale entry, priorityblockingqueue cancel pattern, priorityblockingqueue reprioritize, priorityblockingqueue lazy deletion, priorityblockingqueue versioned entry, priorityblockingqueue remove linear cost, priorityblockingqueue cancelled task stale skip, java priorityblockingqueue update priority safely, java priorityblockingqueue duplicate ticket normal, priorityblockingqueue beginner bridge, 자바 PriorityBlockingQueue 취소, 자바 PriorityBlockingQueue 중복 엔트리, 자바 PriorityBlockingQueue stale entry, 자바 PriorityBlockingQueue 우선순위 변경\n\n## 먼저 잡을 멘탈 모델\n\n`PriorityBlockingQueue`를 \"여러 스레드가 함께 쓰는 우선순위 inbox\"로 보면 쉽다.\n\n- inbox 안에 이미 들어간 편지를 직접 고쳐서 재정렬한다고 기대하지 않는다\n- cancel이나 priority update는 \"새 상태를 담은 새 편지\"를 넣는 쪽에 가깝다\n- 나중에 꺼낸 편지가 최신이 아니면 stale로 버린다\n\n즉 초보자 기본값은 이것이다.\n\n> `PriorityBlockingQueue`에서는 **중복 entry가 생길 수 있고, 그 자체가 곧 버그는 아니다.**\n> 중요한 것은 `poll()`/`take()` 뒤에 \"이 entry가 아직 최신인가?\"를 한 번 더 확인하는 것이다.\n\n## 한 장 비교표\n\n| 상황 | 바로 떠올릴 기본 패턴 | 왜 이렇게 하나 |\n|---|---|---|\n| priority를 바꾸고 싶다 | 새 entry `offer` + 예전 entry stale 처리 | queue 안 원소 제자리 수정은 자동 재정렬을 기대하기 어렵다 |\n| task를 취소하고 싶다 | shared state에서 inactive 처리 + worker가 stale skip | queue 중간의 exact entry를 항상 싸게 지우는 구조가 아니다 |\n| queue 안에 같은 task가 두 번 보인다 | 중복 자체보다 \"최신 판별\"을 먼저 본다 | lazy update/cancel 패턴에서는 자연스럽다 |\n| \"취소했는데 왜 아직 남아 있지?\" | queue 안 잔류와 실제 실행 여부를 분리해서 본다 | 남아 있어도 worker가 stale로 버리면 실행은 막을 수 있다 |\n\n## cancel, duplicate, stale entry를 같이 보면 덜 헷갈린다\n\n예를 들어 작업 `A`가 있다고 하자.\n\n1. `A(priority=5, version=1)`을 넣는다.\n2. 나중에 더 급해져서 `A(priority=1, version=2)`를 다시 넣는다.\n3. 그 뒤 아예 취소해서 현재 상태를 `inactive`로 바꾼다.\n\n이때 queue 안에는 예전 `A` entry들이 남아 있을 수 있다.\n초보자는 여기서 \"중복이니까 잘못됐다\"고 느끼기 쉽지만, 실제 판단 기준은 더 단순하다.\n\n- queue 안에 남아 있는가?\n- 지금 꺼낸 entry가 **최신 version**인가?\n- 그 task가 **현재 active 상태**인가?\n\n마지막 두 질문에 `아니오`가 나오면 stale로 버리면 된다.\n\n즉 cancel의 핵심은 \"queue에서 흔적을 0으로 만드는 것\"이 아니라,\n\"worker가 더 이상 실행하지 못하게 만드는 것\"이다.\n\n## 초보자 기본 예시\n\n```java\nimport java.util.Comparator;\nimport java.util.concurrent.ConcurrentHashMap;\nimport java.util.concurrent.PriorityBlockingQueue;\n\nrecord TaskState(long version, boolean active) {}\nrecord QueueEntry(String taskId, int priority, long version, Runnable job) {}\n\npublic final class TaskInbox {\n    private final PriorityBlockingQueue<QueueEntry> queue =\n            new PriorityBlockingQueue<>(11,\n                    Comparator.<QueueEntry>comparingInt(QueueEntry::priority)\n                            .thenComparingLong(QueueEntry::version));\n\n    private final ConcurrentHashMap<String, TaskState> stateByTask =\n            new ConcurrentHashMap<>();\n\n    public void upsert(String taskId, int priority, Runnable job) {\n        TaskState next = stateByTask.compute(taskId, (id, oldState) -> {\n            long nextVersion = oldState == null ? 1L : oldState.version() + 1L;\n            return new TaskState(nextVersion, true);\n        });\n\n        queue.offer(new QueueEntry(taskId, priority, next.version(), job));\n    }\n\n    public void cancel(String taskId) {\n        stateByTask.computeIfPresent(taskId, (id, oldState) ->\n                new TaskState(oldState.version() + 1L, false));\n    }\n\n    public QueueEntry takeLive() throws InterruptedException {\n        while (true) {\n            QueueEntry entry = queue.take();\n            TaskState state = stateByTask.get(entry.taskId());\n\n            if (state == null) {\n                continue; // 이미 사라진 task\n            }\n\n## 초보자 기본 예시 (계속 2)\n\nif (!state.active()) {\n                continue; // 취소된 뒤 남아 있던 stale entry\n            }\n            if (state.version() != entry.version()) {\n                continue; // update 전에 넣어 둔 오래된 entry\n            }\n\n            return entry;\n        }\n    }\n}\n```\n\n이 코드에서 beginner가 꼭 가져갈 포인트는 세 가지다.\n\n- `update`는 기존 entry 수정이 아니라 `version` 증가 + 새 entry 추가다\n- `cancel`은 지금 유효한 버전을 한 번 더 넘기고 `active=false`로 만든다\n- worker는 `take()` 직후 `active`와 `version`을 같이 검사한다\n\n## `remove()`로 바로 지우면 안 되나요?\n\n가능은 하다.\n하지만 beginner 기본값으로는 바로 그 방향을 추천하지 않는 편이 안전하다.\n\n| 질문 | beginner 기본 답 |\n|---|---|\n| `PriorityBlockingQueue.remove(entry)`가 있지 않나 | 있다 |\n| 그걸 cancel/update 기본 패턴으로 써도 되나 | 보통은 아니다 |\n| 이유는 | exact entry를 찾는 비용, 동등성 기준, concurrent update 타이밍까지 함께 신경 써야 하기 때문이다 |\n\n즉 처음에는 이렇게 구분하면 충분하다.\n\n- \"지금 당장 queue에서 없애는 것\"과\n- \"실제로 실행되지 못하게 막는 것\"\n\n`PriorityBlockingQueue`에서는 두 번째가 더 중요한 경우가 많다.\n\n## 자주 하는 오해\n\n- `PriorityBlockingQueue`가 thread-safe니까 priority update도 자동 안전하다고 생각한다.\n- queue 안 중복 entry를 보면 무조건 데이터 버그라고 생각한다.\n- cancel 후에도 queue 크기가 바로 안 줄면 취소가 실패했다고 생각한다.\n- `take()`로 꺼냈으면 바로 실행해도 된다고 생각한다.\n- deadline 기반 대기까지 기대한다. 이건 [PriorityBlockingQueue Timer Misuse Primer](../../data-structure/priorityblockingqueue-timer-misuse-primer.md) 쪽 질문이다.\n\n## 한 줄 정리\n\n`PriorityBlockingQueue`에서 cancel/update의 초보자 기본값은 **새 entry 추가, old entry stale 처리, worker의 최신성 검사** 세 줄로 기억하면 된다.\n",
  "aliases": [
    "PriorityBlockingQueue Cancellation Update Mini Bridge",
    "PriorityBlockingQueue stale entry",
    "PriorityBlockingQueue cancel pattern",
    "PriorityBlockingQueue duplicate entry update",
    "versioned entry lazy deletion",
    "자바 PriorityBlockingQueue 취소 stale entry",
    "final",
    "record"
  ],
  "expected_queries": [
    "PriorityBlockingQueue에서 priority update나 cancel은 새 entry를 넣고 old entry를 stale로 버리는 패턴이 왜 기본이야?",
    "PriorityBlockingQueue에 duplicate entry가 남아도 worker가 latest version과 active 상태를 확인하면 괜찮아?",
    "취소했는데 queue 안에 흔적이 남아 있는 것과 실제 실행을 막는 것은 어떻게 달라?",
    "PriorityBlockingQueue remove가 항상 싼 구조가 아니어서 lazy deletion을 쓰는 이유를 알려줘",
    "versioned entry stale skip 패턴을 beginner 코드로 설명해줘"
  ],
  "symptoms": [
    "PriorityBlockingQueue 안 entry를 직접 수정하면 자동으로 heap order가 갱신될 것이라고 기대해 priority update가 반영되지 않는 문제를 만든다",
    "cancel 후에도 queue 안에 entry가 남아 있으면 실행도 반드시 된다고 오해해 queue residue와 worker stale skip을 구분하지 못해",
    "같은 task의 duplicate entry가 보이면 곧바로 버그라고 판단하고 versioned latest check나 inactive state check를 설계하지 않아"
  ],
  "relations": {
    "prerequisites": [
      "language/priority-update-patterns-treeset-treemap-priorityqueue-bridge",
      "language/thread-interruption-cooperative-cancellation-playbook",
      "data-structure/java-priorityqueue-pitfalls"
    ],
    "next_docs": [
      "data-structure/priorityblockingqueue-timer-misuse-primer",
      "data-structure/mutable-priority-stale-ticket-pattern",
      "language/thread-interruption-cooperative-cancellation-playbook"
    ],
    "confusable_with": [
      "language/priority-update-patterns-treeset-treemap-priorityqueue-bridge",
      "data-structure/mutable-priority-stale-ticket-pattern",
      "data-structure/java-priorityqueue-pitfalls"
    ],
    "forbidden_for_queries": []
  },
  "learner_query_patterns": [],
  "metadata": {
    "schema_version": "v2",
    "created_at": "2026-05-24",
    "last_modified": "2026-05-24",
    "legacy_path": "knowledge/cs/contents/language/java/priorityblockingqueue-cancellation-stale-entry-mini-bridge.md",
    "revision_history": []
  }
}