{
  "id": "database/for-update-vs-advisory-lock-vs-lease-fencing-decision-guide",
  "title": "FOR UPDATE Row Lock vs Advisory Lock vs Lease/Fencing 결정 가이드",
  "category": "database",
  "level": "beginner",
  "summary": "existing row를 안전하게 바꿀 일이면 FOR UPDATE row lock, 짧은 작업 진입 게이트면 advisory lock, 긴 실행과 takeover 및 stale write 방지까지 필요하면 lease/fencing을 먼저 본다.",
  "body_markdown": "# FOR UPDATE Row Lock vs Advisory Lock vs Lease/Fencing 결정 가이드\n\n## 한 줄 요약\n\n> existing row를 안전하게 바꿀 일이면 `FOR UPDATE` row lock, 짧은 작업 진입 게이트면 advisory lock, 긴 실행과 takeover 및 stale write 방지까지 필요하면 lease/fencing을 먼저 본다.\n\n## 결정 매트릭스\n\n| 지금 지키려는 것 | 1차 선택 | 이유 |\n|---|---|---|\n| 이미 존재하는 주문·재고 row를 한 트랜잭션 안에서 읽고 곧바로 수정 | `FOR UPDATE` row lock | 보호 대상이 데이터 row 자체라서 DB가 가장 직접적으로 중재한다 |\n| 같은 리포트 생성 버튼이나 같은 테넌트 배치 진입을 짧게 한 명만 통과 | advisory lock | row가 아니라 \"작업 이름\"을 잠그는 게 자연스럽고 세션 단위 게이트로 쓰기 쉽다 |\n| 몇 분 이상 도는 worker 작업에서 소유권 유지와 takeover가 필요 | lease + fencing | 락을 오래 쥐기보다 owner 교체와 stale worker 차단을 별도 규칙으로 다뤄야 한다 |\n| queue claim은 빨라야 하지만 실행 ownership은 오래 유지돼야 함 | claim은 `SKIP LOCKED`, ownership은 lease | 선점과 장기 실행 책임은 다른 문제라 분리해야 안전하다 |\n\n짧게 기억하면 `FOR UPDATE`는 데이터 충돌, advisory lock은 진입 통제, lease/fencing은 장기 소유권과 늦은 쓰기 차단에 맞는다.\n\n## 보장 범위와 failure mode\n\n| 도구 | 실제로 보장하는 범위 | 자주 터지는 failure mode | 같이 둬야 하는 방어선 |\n|---|---|---|---|\n| `FOR UPDATE` row lock | 한 DB 트랜잭션 안에서 이미 선택된 row의 동시 수정을 직렬화한다 | 빈 row나 넓은 predicate는 DB/격리 수준에 따라 보호되지 않을 수 있고, 긴 트랜잭션은 blocker, deadlock, timeout을 만든다 | unique/exclusion constraint, 짧은 transaction, canonical lock order, retry 가능한 실패 처리 |\n| advisory lock | 같은 DB의 같은 lock key를 쓰는 참여자 사이에서 짧은 critical section 진입을 제한한다 | 참여하지 않는 코드 경로는 우회하고, session-scoped lock은 커넥션 풀/세션 끊김과 얽혀 예상보다 오래 남거나 갑자기 풀릴 수 있다 | transaction-scoped 사용 검토, lock key naming 규칙, timeout, finally unlock, non-participant write 방지 |\n| lease + fencing | 일정 시간 동안의 작업 소유권과 owner 교체를 모델링하고, 더 최신 owner만 write하게 만든다 | worker pause/network 지연 뒤 stale worker가 돌아와 늦은 write를 할 수 있다. token 검증이 없는 downstream에는 lease가 전파되지 않는다 | monotonic fencing token, heartbeat/expiry, compare-and-swap renewal, downstream token check, idempotent job result |\n\n핵심 caveat는 \"lock owner\"의 의미가 도구마다 다르다는 점이다. `FOR UPDATE`의 owner는 비즈니스 worker가 아니라 DB transaction이고, session-scoped advisory lock의 owner는 애플리케이션 인스턴스가 아니라 DB connection/session이다. lease에서만 owner가 보통 `worker_id`, `attempt_id`, `expires_at`, `fencing_token` 같은 업무 상태로 모델링된다.\n\n### fencing token과 늦은 write 차단\n\nlease는 \"내가 지금 owner다\"라는 주장만으로 충분하지 않다. 새 owner가 lease를 가져간 뒤 예전 worker가 GC pause나 네트워크 지연에서 돌아와 결과를 쓰면, 둘 다 한때는 owner였다는 점만으로는 충돌을 가를 수 없다.\n\n그래서 lease 획득 시 DB sequence나 원자적 update로 단조 증가하는 `fencing_token`을 발급하고, 모든 결과 write에 그 token을 포함시킨다. downstream 테이블이나 외부 adapter는 `last_applied_token`보다 작은 token을 거부해야 한다. 이 검증이 빠지면 lease는 진입 로그일 뿐, stale write 방어선이 아니다.\n\n### 중복 실행, 순서, replay를 나눠 보는 기준\n\n- 중복 실행: queue claim이나 lease takeover는 같은 job이 두 worker에서 겹칠 수 있음을 전제로 둔다. job result에는 `job_id + attempt_id` 또는 `job_id + fencing_token` 기준의 멱등 처리가 필요하다.\n- 순서: long-running job은 시작 순서보다 적용 순서가 중요하다. 최신 fencing token만 적용되게 하면 오래된 attempt가 늦게 끝나도 상태를 되돌리지 않는다.\n- replay: 실패 job replay는 이전 attempt를 삭제하고 새로 시작하는 절차가 아니다. 기존 attempt status, side effect idempotency key, last token을 확인하고 안전한 단계부터 재개한다.\n- owner caveat: \"락을 잡은 코드\"와 \"실제 write를 수행하는 코드\"가 다르면 보장이 샌다. 락 밖의 batch, 수동 운영 스크립트, 다른 서비스 write path까지 같은 token/constraint를 확인해야 한다.\n\n## 흔한 오선택\n\n가장 흔한 오선택은 긴 배치를 `FOR UPDATE`로 붙잡아 두는 것이다. 학습자 표현으로는 \"어차피 한 명만 돌면 되니까 row 하나 잠그고 끝 아닌가?\"에 가깝다. row lock은 트랜잭션 안의 데이터 충돌에는 강하지만, 몇 분짜리 외부 호출이나 worker 재시작까지 품기 시작하면 커넥션 점유와 timeout만 커지고 takeover 규칙은 비어 있게 된다.\n\nadvisory lock을 lease 대체재로 보는 것도 자주 틀린다. \"DB에서 락 하나만 잡으면 다른 worker가 못 들어오니까 충분한 것 아닌가?\"처럼 들리지만, 세션이 끊겼다가 늦게 살아난 worker의 stale write까지 막으려면 단조 증가 token 같은 fencing 규칙이 필요하다. advisory lock만으로는 \"누가 최신 owner인가\"를 후속 write 경로까지 밀어 넣기 어렵다.\n\n반대로 기존 row 수정인데 lease부터 떠올리는 것도 과하다. 주문 상태 변경이나 재고 차감처럼 충돌 surface가 이미 row라면, 먼저 row lock이나 원자적 update로 닫는 편이 더 직접적이다. 이 장면에서 lease를 먼저 들고 오면 보호 대상보다 coordination 레이어가 더 커져 설계가 불필요하게 복잡해진다.\n\n또 하나의 위험한 오선택은 advisory lock 획득을 \"작업 소유권 저장\"으로 착각하는 것이다. advisory lock은 같은 key를 잡으려는 동시 진입을 막을 수는 있지만, 결과를 쓰는 테이블이 누가 최신 owner인지 확인하지 않으면 replay나 지연 worker의 overwrite를 막지 못한다. 장기 job에서는 lock 획득 로그보다 token이 write 경로에 실제로 검증되는지가 더 중요하다.\n\n## 다음 학습\n\nrow lock과 작업 게이트의 차이를 더 짧게 붙잡고 싶으면 [Advisory Locks와 Row Locks](./advisory-locks-vs-row-locks.md)를 먼저 본다.\n\nstale worker, heartbeat 지연, fencing token이 왜 필요한지 이어서 보려면 [DB Lease와 Fencing Token](./db-lease-fencing-coordination.md)으로 내려가면 된다.\n\nqueue claim과 긴 job ownership을 분리하는 장면이 궁금하면 [Queue Claim with `SKIP LOCKED`, Fairness, and Starvation Trade-offs](./queue-claim-skip-locked-fairness.md)와 [Transactional Claim-Check와 Job Leasing](./transactional-claim-check-job-leasing.md)을 다음 문서로 잡으면 된다.\n",
  "aliases": [
    "작업 중복 실행 방지 락 선택",
    "포업데이트 advisory lease 차이",
    "긴 작업 락 뭐 써야 해",
    "stale worker 막는 락",
    "배치 한 번만 실행 락 선택",
    "row lock vs advisory lock vs lease",
    "for update advisory lock lease choice",
    "distributed lock vs row lock beginner",
    "job ownership vs data row lock",
    "advisory lock or lease fencing",
    "for update vs advisory guide",
    "for update vs advisory checklist"
  ],
  "expected_queries": [
    "같은 작업을 한 번만 실행시키려면 SELECT FOR UPDATE, advisory lock, lease 중 무엇부터 골라야 해?",
    "배치가 몇 분씩 도는데 row lock으로 버티면 안 되는 이유가 뭐야?",
    "worker가 죽으면 다른 worker가 이어받아야 할 때 advisory lock 말고 lease가 필요한가?",
    "기존 row 수정이 아니라 job ownership 문제인데 FOR UPDATE를 쓰면 어디서 어긋나?",
    "stale worker가 늦게 돌아와 덮어쓰는 상황까지 막으려면 어떤 패턴을 봐야 해?",
    "advisory lock을 잡은 worker가 lock owner면 늦은 write도 안전한 거야?"
  ],
  "symptoms": [
    "한 번만 실행되게 하고 싶은데 FOR UPDATE와 advisory lock과 lease를 같은 도구로 보고 있다",
    "긴 배치를 DB row lock으로 잡아 두려다가 어디까지 잠가야 하는지 헷갈린다",
    "worker takeover가 필요한 작업인데 advisory lock만으로 충분한지 모르겠다"
  ],
  "relations": {
    "prerequisites": [
      "database/transaction-basics",
      "database/lock-basics"
    ],
    "next_docs": [
      "database/advisory-locks-vs-row-locks",
      "database/db-lease-fencing-coordination",
      "database/queue-claim-skip-locked-fairness"
    ],
    "confusable_with": [
      "database/advisory-locks-vs-row-locks",
      "database/db-lease-fencing-coordination",
      "database/queue-claim-skip-locked-fairness",
      "database/nowait-vs-skip-locked-vs-short-lock-timeout-decision-guide"
    ],
    "forbidden_for_queries": []
  },
  "learner_query_patterns": [],
  "metadata": {
    "schema_version": "v2",
    "created_at": "2026-05-24",
    "last_modified": "2026-06-18",
    "legacy_path": "knowledge/cs/contents/database/for-update-vs-advisory-lock-vs-lease-fencing-decision-guide.md",
    "revision_history": [
      {
        "date": "2026-06-18",
        "source": "y14-expansion-batch152"
      }
    ]
  }
}
